title,description,website,excerpt,participants,start_date,end_date,private,online,address,address2,city,country,state,latitute,longitude,postcode
ESMO Summit Africa 2017 äóñ Oncology Updates: From Evidence to Practice,"The ESMO Summit Africa is a three-day educational event with presentations focused on several key disease sites. Created for oncology professionals in Africa by international and local key opinion leaders, the summit will put into context the most significant treatment advances presented at the ESMO annual congress.",http://esmo.org/Conferences/ESMO-Summit-Africa-2017,,"Andrí©s Cervantes, Jeannette Parkes, Bernardo Rapoport",2/10/2017,2/12/2017,FALSE,FALSE,,,Cape Town,South Africa,,-33.924869,18.424055,
48th Annual Congress of the International Society of Paediatric Oncology (SIOP),"The 48th Annual Congress of the International Society of Paediatric Oncology (SIOP) will be in Dublin Ireland. We are delighted to present an exciting and stimulating scientific programme which will facilitate the exchange of ideas and information in paediatric oncology. The congress will be highlighted by engaging sessions given by world renowned experts. Tailored to the entire SIOP community of clinicians, scientists, nurses, allied health professionals, parents and survivors, the world's leading paediatric oncology congress is your opportunity to engage with colleagues from across the globe striving towards a world free of childhood cancer.",http://siop2016.kenes.com/,,,10/19/2016,10/19/2016,FALSE,FALSE,The Convention Centre Dublin (CCD)äó†äó† Spencer Dock North Wall Quay,,Dublin,Ireland,,53.347499,-6.239838,
10th International Symposium on Hodgkin Lymphoma (ISHL),"ISHL is the largest international and interdisciplinary conference on Hodgkin Lymphoma worldwide. ISHL10 will cover the most recent results in basic research, diagnosis and treatment of Hodgkin Lymphoma with a special emphasis on new treatment approaches and a special focus on immunotherapy. Satellite Symposia and specialized workshops will complement the program. In addition, there will be interactive case discussions and a comprehensive Hematology Educational. Participate in this symposium and become actively involved in this exchange of ideas and the most recent developments in the field of Hodgkin Lymphoma!",www.hodgkinsymposium.org.,,,10/22/2016,10/25/2016,FALSE,FALSE,,,Cologne,Germany,,50.938644,6.953885,
15th International Workshop on Multiple Endocrine Neoplasia and other rare endocrine tumors,"This meeting will bring together experts and practitioners from all over the globe, actively involved in patient care, clinical and basic research, as well as advocacy groups of patients with rare endocrine tumor syndromes. We will provide an inspiring program including the state of the art care and research.",http://worldmen2016.org/,,,9/29/2016,10/1/2016,FALSE,FALSE,Jaabeursplein 6 3521 AL Utrecht,,Utrecht,Netherlands,,52.088211,5.107476,
The 9th China Conference on Oncology & The 15th Cross-Strait Academic Conference on Oncology,"The China Confernce on Oncology (CCO) is one of the most significant and influential academic conference in the field of oncology launched by CACA. CCO is held biennially since 2000 and thousands of delegates attended each time. The 9th China Confernce on Oncology & The 15th Cross-Strait Academic Conference on Oncology will be held from Oct. 13, 2016 to Oct. 16, 2016 in Wuhan, Hubei Province. The theme is ""Standardized Precision and Improving Practice on Cancer"". The conference will have plenary session and concurrent symposiums. Well-known experts will be invited and approximate thousands of delegates attend the conference.",http://www.cco2016.org/,,,10/13/2006,10/16/2014,FALSE,FALSE,,,Tianjin,China,,39.084158,117.200983,